Who,scraped_datetime,Headline,Url,Site,Siteurl,Published
SCMP Graphics,2024_06_18_05,Havoc in the sky: when in-flight turbulence is more than a few bumps,https://multimedia.scmp.com/infographics/news/world/article/3264547/turbulences-infographic/index.html,SCMP,https://www.scmp.com,2024_05_31_00
SCMP Graphics,2024_06_18_05,Hong Kong 47: who are the activists convicted and cleared in pivotal national security trial?,https://multimedia.scmp.com/infographics/news/hong-kong/article/3264504/hkdemocrats-trial/index.html,SCMP,https://www.scmp.com,2024_05_30_00
SCMP Graphics,2024_06_18_05,Plastic unfantastic: what’s banned in Hong Kong’s war on waste,https://multimedia.scmp.com/infographics/news/hong-kong/article/3259438/plastic-ban/index.html,SCMP,https://www.scmp.com,2024_04_19_00
SCMP Graphics,2024_06_18_05,Hong Kong Rugby Sevens’ nearly 50-year history,https://multimedia.scmp.com/infographics/sport/article/3257646/rugby-seven-2024/index.html,SCMP,https://www.scmp.com,2024_04_04_00
SCMP Graphics,2024_06_18_05,All you need to know about Hong Kong’s domestic security law,https://multimedia.scmp.com/infographics/news/hong-kong/article/3254557/article23law/index.html,SCMP,https://www.scmp.com,2024_03_08_00
SCMP Graphics,2024_06_18_05,How the SCMP creates its award-winning infographics,https://multimedia.scmp.com/infographics/news/hong-kong/article/3253386/behindthescenes,SCMP,https://www.scmp.com,2024_02_29_00
SCMP Graphics,2024_06_18_05,Ukraine-Russia war grinds into third year,https://multimedia.scmp.com/infographics/news/world/article/3252688/ukraine-war-two-years/index.html,SCMP,https://www.scmp.com,2024_02_22_00
SCMP Graphics,2024_06_18_05,Complete visual guide to the Year of the Dragon 2024,https://multimedia.scmp.com/infographics/culture/article/3250661/year-of-the-dragon/index.html,SCMP,https://www.scmp.com,2024_02_06_00
SCMP Graphics,2024_06_18_05,Uncovering Hong Kong’s secret land grab,https://multimedia.scmp.com/infographics/news/hong-kong/article/3250772/unauthorised-structures/index.html,SCMP,https://www.scmp.com,2024_02_05_00
SCMP Graphics,2024_06_18_05,Lionel Messi: the living legend,https://multimedia.scmp.com/infographics/sport/article/3250175/messi/index.html,SCMP,https://www.scmp.com,2024_02_01_00
