Who,scraped_datetime,Headline,Url,Site,Siteurl,Published
SCMP Graphics,2025_09_12_11,The Red Arsenal: inside China’s cutting-edge weapon systems,https://multimedia.scmp.com/infographics/news/china/article/3322445/china-weapons/?module=breaking&pgtype=homepage,SCMP,https://www.scmp.com,2025_08_25_00
SCMP Graphics,2025_09_12_11,"A visual journey through the life of Ozzy Osbourne, rock’s Prince of Darkness",https://multimedia.scmp.com/infographics/culture/article/3320973/ozzy-osbourne/index.html,SCMP,https://www.scmp.com,2025_08_07_00
SCMP Graphics,2025_09_12_11,"Visualising Hiroshima and Nagasaki casualties, the world’s first atomic attacks",https://multimedia.scmp.com/infographics/news/world/article/3320825/hiroshima_nagasaki/index.html,SCMP,https://www.scmp.com,2025_08_06_00
SCMP Graphics,2025_09_12_11,All the sparks of one year,https://multimedia.scmp.com/infographics/news/hong-kong/article/3319248/yp-spark-infographic/index.html,SCMP,https://www.scmp.com,2025_07_24_00
SCMP Graphics,2025_09_12_11,How China’s rare earth leadership can impact US defence procurement,https://multimedia.scmp.com/infographics/news/china/article/3313870/critical-minerals-leadership/index.html,SCMP,https://www.scmp.com,2025_06_11_00
SCMP Graphics,2025_09_12_11,Death stranding: why marine mammals wash ashore in Hong Kong,https://multimedia.scmp.com/infographics/news/hong-kong/article/3312243/marine-life-stranding/,SCMP,https://www.scmp.com,2025_06_02_00
SCMP Graphics,2025_09_12_11,Pets on Hong Kong public transport: a visual guide on how the city is relaxing rules,https://multimedia.scmp.com/infographics/news/hong-kong/article/3310994/pet_on_mtr/index.html,SCMP,https://www.scmp.com,2025_05_26_00
SCMP Graphics,2025_09_12_11,"Chosen one: a visual guide to Pope Leo XIV, leader of the world's 1.4 billion Catholics",https://multimedia.scmp.com/infographics/news/world/article/3310236/habemus-papa/index.html,SCMP,https://www.scmp.com,2025_05_14_00
SCMP Graphics,2025_09_12_11,In hot water: CK Hutchison’s ports deal risks being dunked,https://multimedia.scmp.com/infographics/news/hong-kong/article/3307617/ckh-port/index.html,SCMP,https://www.scmp.com,2025_04_24_00
SCMP Graphics,2025_09_12_11,The China-US face-off: a visual guide to Donald Trump and Xi Jinping’s inner circles,https://multimedia.scmp.com/infographics/news/china/article/3300868/china_us_powers/index.html?1,SCMP,https://www.scmp.com,2025_03_07_00
