Who,scraped_datetime,Headline,Url,Site,Siteurl,Published
ABC Storylab,2026_07_01_05,"As Ebola spreads, Australia faces rise in 'biblical' disease risks",https://www.abc.net.au/news/2026-06-25/as-ebola-spreads-australia-faces-rise-in-biblical-disease-risks/106736608,ABC,https://www.abc.net.au,2026_06_24_21
ABC Storylab,2026_07_01_05,Perfect dupes of ABC articles are fuelling an industrial-scale scam,https://www.abc.net.au/news/2026-06-23/fake-abc-website-scam-facebook-ads/106653690,ABC,https://www.abc.net.au,2026_06_23_00
ABC Storylab,2026_07_01_05,Why this Socceroos squad is like no other,https://www.abc.net.au/news/2026-06-14/one-goal-many-journeys/106684994,ABC,https://www.abc.net.au,2026_06_18_03
ABC Storylab,2026_07_01_05,Elon Musk now has an unfathomable amount of money. It looks a bit like this,https://www.abc.net.au/news/2026-06-13/visualising-elon-musk-trillion-dollar-wealth/106780212,ABC,https://www.abc.net.au,2026_06_13_01
ABC Storylab,2026_07_01_05,The scale of the mouse plague is hard to fathom. Here's a visualisation,https://www.abc.net.au/news/2026-05-24/visualising-australias-mouse-plague/106696622,ABC,https://www.abc.net.au,2026_05_26_02
ABC Storylab,2026_07_01_05,"Power rationed, medical supplies in doubt as fuel crisis lingers for millions",https://www.abc.net.au/news/2026-05-18/the-ripples-of-the-iran-war-are-everywhere/106591410,ABC,https://www.abc.net.au,2026_05_18_03
ABC Storylab,2026_07_01_05,These charts show how Coles Down Down pricing patterns duped shoppers,https://www.abc.net.au/news/2026-05-14/coles-grocery-pricing-down-down-accc-court-visual-guide/106678288,ABC,https://www.abc.net.au,2026_05_14_03
ABC Storylab,2026_07_01_05,Use our calculator to work out how much the budget changes could save you,https://www.abc.net.au/news/2026-05-13/2026-federal-budget-tax-cuts-calculator/106672568,ABC,https://www.abc.net.au,2026_05_12_23
ABC Storylab,2026_07_01_05,Top-earning Australians make money very differently from typical workers,https://www.abc.net.au/news/2026-05-10/how-everyone-is-making-money-and-what-it-means-for-their-tax/106639592,ABC,https://www.abc.net.au,2026_05_10_09
ABC Storylab,2026_07_01_05,Israeli money launderer found guilty in Sydney investment scam trial,https://www.abc.net.au/news/2026-05-08/shabtay-yaacoby-found-guilty-money-laundering-scams/106656936,ABC,https://www.abc.net.au,2026_05_08_03
