Who,scraped_datetime,Headline,Url,Site,Siteurl,Published
ABC Alex Palmer,2025_09_11_05,IDF displacement orders suggest Israel's ultimate plan for Gaza,https://www.abc.net.au/news/2025-08-20/israel-evacuation-orders-across-gaza-redraw-map/105630686,ABC,https://www.abc.net.au,2025_08_19_18
ABC Alex Palmer,2025_09_11_05,Investigating Australia's childcare crisis,https://www.abc.net.au/news/2025-07-16/betrayal-of-trust-childcare-investigation/105510958,ABC,https://www.abc.net.au,2025_07_16_07
ABC Alex Palmer,2025_09_11_05,Unlocking secrets hidden inside the world's most precious specimens,https://www.abc.net.au/news/2025-07-12/3d-model-ct-scans-show-secrets-deep-inside-the-museum-specimens/105370648,ABC,https://www.abc.net.au,2025_07_11_19
ABC Alex Palmer,2025_09_11_05,"Satellite images show impact craters, building damage at Iranian nuclear sites",https://www.abc.net.au/news/2025-06-23/satellite-images-show-damage-at-iranian-nuclear-sites/105449430,ABC,https://www.abc.net.au,2025_06_23_05
ABC Alex Palmer,2025_09_11_05,Inside the Iranian nuclear bunker Trump claims to have 'obliterated',https://www.abc.net.au/news/2025-06-22/inside-iran-fordow-nuclear-bunker-bombed-by-us/105446636,ABC,https://www.abc.net.au,2025_06_22_22
ABC Alex Palmer,2025_09_11_05,The key to Iran's nuclear program lies under these mountains,https://www.abc.net.au/news/2025-06-21/inside-irans-fordow-nuclear-bunker/105441722,ABC,https://www.abc.net.au,2025_06_20_18
ABC Alex Palmer,2025_09_11_05,The strange 'ballot-fellows' revealed on parties' how-to-vote cards,https://www.abc.net.au/news/2025-05-01/how-to-vote-cards-in-your-electorates/105217758,ABC,https://www.abc.net.au,2025_05_01_04
ABC Alex Palmer,2025_09_11_05,Ballooning rents outpace wages in every region and all but one capital city,https://www.abc.net.au/news/2025-04-16/charts-show-how-fast-rent-has-outpaced-income-across-australia/105179340,ABC,https://www.abc.net.au,2025_04_15_22
ABC Alex Palmer,2025_09_11_05,This town is a 'canary in the coal mine' as climate change threatens home ownership,https://www.abc.net.au/news/2025-04-15/climate-change-pushing-up-insurance-risk-data-shows/105154662,ABC,https://www.abc.net.au,2025_04_14_22
ABC Alex Palmer,2025_09_11_05,Are you living in one of Australia's least affordable rental suburbs?,https://www.abc.net.au/news/2025-04-07/the-postcodes-where-rent-chews-up-half-your-pay-cheque/105118336,ABC,https://www.abc.net.au,2025_04_08_02
