Who,scraped_datetime,Headline,Url,Site,Siteurl,Published,Description
Random wiki,2026_05_03_05,Romantic Lover,https://en.wikipedia.org/wiki/Romantic_Lover,Wikipedia,https://en.wikipedia.org,2026_05_03_05,"""Romantic Lover"" is a song by Filipino musician Eyedress, first released as a self-directed music video on YouTube 12 January 2020.[1] On 10 July that year it was announced that the song would be released on his next album, Let's Skip to the Wedding (2020).[2] It was the fourth of nine album tracks to be released as singles from Let's Skip to the Wedding."
Random wiki,2026_05_03_05,Zearchaea,https://en.wikipedia.org/wiki/Zearchaea,Wikipedia,https://en.wikipedia.org,2026_05_03_05,"Zearchaea is a genus of spiders in the Mecysmaucheniidae family. It was first described in 1946 by Wilton.[2] As of February 2019[update], it contains 2 species from New Zealand.[1]"
Random wiki,2026_05_03_05,Alisertib,https://en.wikipedia.org/wiki/Alisertib,Wikipedia,https://en.wikipedia.org,2026_05_03_05,"Alisertib (MLN8237) is an orally available, investigational, reversible, ATP-competitive, selective aurora A kinase inhibitor developed by Takeda.[1] Inhibition of aurora A kinase A leads to disruption of mitotic spindle apparatus assembly, disruption of chromosome segregation, and inhibition of cell proliferation.[2][3]"
Random wiki,2026_05_03_05,Malta Chess Federation,https://en.wikipedia.org/wiki/Malta_Chess_Federation,Wikipedia,https://en.wikipedia.org,2026_05_03_05,"The Malta Chess Federation (also known as MCF and in Maltese: Il-Federazzjoni Maltija taċ-Ċess) is the governing body for chess competition in Malta and represents Malta in FIDE, the World Chess Federation.[1] MCF does not administer an official national rating system but relies on the International Elo rating system administered by FIDE ."
Random wiki,2026_05_03_05,PB Swiss Tools,https://en.wikipedia.org/wiki/PB_Swiss_Tools,Wikipedia,https://en.wikipedia.org,2026_05_03_05,PB Swiss Tools AG is a manufacturer of hand tools based in Switzerland.
