Who,scraped_datetime,Headline,Url,Site,Siteurl,Published,Description
Random wiki,2026_02_26_05,First war against Swantopolk II,https://en.wikipedia.org/wiki/First_war_against_Swantopolk_II,Wikipedia,https://en.wikipedia.org,2026_02_26_05,"The first war against Swantopolk II was a military conflict in Pomerelia and Kuyavia. It was fought between 1236 and 1238 by the Duchy of Lubiszewo, and later the Mecklenburgian forces, both led by Sambor II, the Duchy of Białogarda, led by Ratibor and the Duchy of Kuyavia, led by Casimir I, all fighting against Duchy of Gdańsk, led by Swantopolk II. The conflict ended with the conquest of Lubiszwo and Białogarda, and subsequent recovery of control over their rulers by Swantopolk II. Additionally, Kuyavia conquered neighboring lands of the Duchy of Gdańsk, and was subsequently raided by it, receiving heavy financial and material losses. Following the war, Swietopelk II was excommunicated by the Catholic Church."
Random wiki,2026_02_26_05,Swimming with Sharks (TV series),https://en.wikipedia.org/wiki/Swimming_with_Sharks_(TV_series),Wikipedia,https://en.wikipedia.org,2026_02_26_05,"Swimming with Sharks is an American psychological drama television series starring Kiernan Shipka and Diane Kruger inspired by the 1994 film of the same name. The series premiered at the SXSW Film Festival and was named one of the ""10 to watch"" by Variety. The series premiered in the US on April 15, 2022 on The Roku Channel and internationally on Amazon Prime Video.[1][2][3]"
Random wiki,2026_02_26_05,"Surabhi, Kadapa district","https://en.wikipedia.org/wiki/Surabhi,_Kadapa_district",Wikipedia,https://en.wikipedia.org,2026_02_26_05,"Surabhi is a village in Chakrayapet Block, Kadapa District (formerly Cuddapah), Andhra Pradesh, India.[1]"
Random wiki,2026_02_26_05,Gilbert Grellet,https://en.wikipedia.org/wiki/Gilbert_Grellet,Wikipedia,https://en.wikipedia.org,2026_02_26_05,"Gilbert Grellet (born on June 30, 1946, in Bordeaux, France), is a French journalist who dedicated his entire career to Agence France-Presse (AFP),[1] one of the three leading global news agencies, alongside Reuters and the Associated Press. In addition to his journalistic work, Grellet is an author of several historical books."
Random wiki,2026_02_26_05,Mary Booth (physician),https://en.wikipedia.org/wiki/Mary_Booth_(physician),Wikipedia,https://en.wikipedia.org,2026_02_26_05,"Mary Booth OBE (1869–1956) was an Australian physician, clubwoman and welfare worker."
