Who,scraped_datetime,Headline,Url,Site,Siteurl,Published,Description
Random wiki,2026_06_08_05,Stephanie Chernikowski,https://en.wikipedia.org/wiki/Stephanie_Chernikowski,Wikipedia,https://en.wikipedia.org,2026_06_08_05,Stephanie Chernikowski (1941–2026) was an American photographer and writer. She documented the New York City punk and new wave scenes of the 1970s and 1980s.[1][2]
Random wiki,2026_06_08_05,Matthew 28:18,https://en.wikipedia.org/wiki/Matthew_28:18,Wikipedia,https://en.wikipedia.org,2026_06_08_05,"Matthew 28:18 is the eighteenth verse of the twenty-eighth chapter of the Gospel of Matthew in the New Testament. This verse is part of the Great Commission narrative, containing the emphatic declaration of Jesus' absolute authority over the universe."
Random wiki,2026_06_08_05,116th Infantry Regiment (United States),https://en.wikipedia.org/wiki/116th_Infantry_Regiment_(United_States),Wikipedia,https://en.wikipedia.org,2026_06_08_05,The 116th Infantry Regiment is an infantry regiment in the Virginia Army National Guard.
Random wiki,2026_06_08_05,"Fayette (community), Wisconsin","https://en.wikipedia.org/wiki/Fayette_(community),_Wisconsin",Wikipedia,https://en.wikipedia.org,2026_06_08_05,"Fayette is an unincorporated community located in the town of Fayette, Lafayette County, Wisconsin, United States.[1] Deriving its name from Lafayette County, the post office was established in August 1849 with Martin W. Anderson as the first postmaster.[2]"
Random wiki,2026_06_08_05,Água Clara,https://en.wikipedia.org/wiki/%C3%81gua_Clara,Wikipedia,https://en.wikipedia.org,2026_06_08_05,"Água Clara is a municipality located in the Brazilian state of Mato Grosso do Sul. Its population was 15,776 (2020) and its area is 11,031 km2 (4,259 sq mi)."
