Who,scraped_datetime,Headline,Url,Site,Siteurl,Published,Description
Random wiki,2026_06_17_06,John M. Nickolaus Jr.,https://en.wikipedia.org/wiki/John_M._Nickolaus_Jr.,Wikipedia,https://en.wikipedia.org,2026_06_17_06,"John Mathew Nickolaus Jr. (May 18, 1913 – February 10, 1985) was an American cinematographer."
Random wiki,2026_06_17_06,Roche Chevrière,https://en.wikipedia.org/wiki/Roche_Chevri%C3%A8re,Wikipedia,https://en.wikipedia.org,2026_06_17_06,"Roche Chevrière is a mountain of Savoie, France. It lies in the Massif de la Vanoise range. It has an elevation of 3,281 metres above sea level."
Random wiki,2026_06_17_06,Judo at the 2004 Summer Olympics – Men's 73 kg,https://en.wikipedia.org/wiki/Judo_at_the_2004_Summer_Olympics_%E2%80%93_Men%27s_73_kg,Wikipedia,https://en.wikipedia.org,2026_06_17_06,Men's 73 kg competition in judo at the 2004 Summer Olympics was held on August 16 at the Ano Liossia Olympic Hall.[1][2]
Random wiki,2026_06_17_06,Jai Prakash Aggarwal,https://en.wikipedia.org/wiki/Jai_Prakash_Aggarwal,Wikipedia,https://en.wikipedia.org,2026_06_17_06,"Jai Prakash Aggarwal (born 11 November 1944) is a politician from the Indian National Congress and a former member of the Parliament of India who has represented North East Delhi and Chandni Chowk in the Lok Sabha, the lower house of the Indian Parliament, and Delhi in the Rajya Sabha, the upper house of the Indian Parliament."
Random wiki,2026_06_17_06,Anthony Midget,https://en.wikipedia.org/wiki/Anthony_Midget,Wikipedia,https://en.wikipedia.org,2026_06_17_06,"Anthony Midget (born February 22, 1978)[3] is an American football coach.[4] He is the assistant secondary coach for the Pittsburgh Steelers of the National Football League (NFL). He played college football at Virginia Tech. After a short-lived career playing professionally in the National Football League (NFL), Midget began coaching beginning at the high school level and then progressing from college to the NFL."
