Who,scraped_datetime,Headline,Url,Site,Siteurl,Published,Description
Random wiki,2026_03_19_05,2013–14 CEV Challenge Cup,https://en.wikipedia.org/wiki/2013%E2%80%9314_CEV_Challenge_Cup,Wikipedia,https://en.wikipedia.org,2026_03_19_05,"The 2013–14 CEV Challenge Cup was the 34th edition of the European Challenge Cup volleyball club tournament, the former CEV Cup."
Random wiki,2026_03_19_05,Emet mine,https://en.wikipedia.org/wiki/Emet_mine,Wikipedia,https://en.wikipedia.org,2026_03_19_05,The Emet mine is a large boron ore mine located at Kütahya Province in western Turkey. Emet represents one of the largest boron reserves in Turkey having an estimated reserve of 1.68 billion tonnes of ore grading 28% boron.[1] Most of this comes in the form of colemanite.[2] The Emet mines together account for 40% of the world's known colemanite reserves.[3]
Random wiki,2026_03_19_05,"Dzierżązna, Łódź Voivodeship","https://en.wikipedia.org/wiki/Dzier%C5%BC%C4%85zna,_%C5%81%C3%B3d%C5%BA_Voivodeship",Wikipedia,https://en.wikipedia.org,2026_03_19_05,
Random wiki,2026_03_19_05,411 East Wisconsin Center,https://en.wikipedia.org/wiki/411_East_Wisconsin_Center,Wikipedia,https://en.wikipedia.org,2026_03_19_05,"The 411 East Wisconsin Center is a high-rise located in Milwaukee, Wisconsin. It was built in 1985 on the former site of the Goldsmith Building.[1] It was designed by Chicago architect, Harry Weese. It is the seventh tallest building in Milwaukee, and it was the second tallest building in Milwaukee at the time of its completion, surpassed by the Milwaukee Center in 1988."
Random wiki,2026_03_19_05,Centennial Trail (South Dakota),https://en.wikipedia.org/wiki/Centennial_Trail_(South_Dakota),Wikipedia,https://en.wikipedia.org,2026_03_19_05,"The South Dakota Centennial Trail, also called the Black Hills Centennial Trail, is a long-distance trail in the Black Hills region of South Dakota. It runs 123 miles (198 km)[note 1] south to north from Wind Cave National Park to Bear Butte State Park. The trail is blazed by a white diamond with a black ""89"" on the top half and a bison skull on the bottom half. It is one of two long-distance hiking trails in Western South Dakota, the other being the nearby George S. Mickelson Trail, which is generally considered easier than the Centennial Trail. The trail has 21 official trailheads.[1] In addition to hiking, the trail is open to mountain biking and horseback riding in most areas.[1][note 2] The Centennial Trail was certified as a National Recreation Trail in 2005.[2]"
