Who,scraped_datetime,Headline,Url,Site,Siteurl,Published,Description
Random wiki,2026_03_21_05,1976 New Hampshire Republican presidential primary,https://en.wikipedia.org/wiki/1976_New_Hampshire_Republican_presidential_primary,Wikipedia,https://en.wikipedia.org,2026_03_21_05,
Random wiki,2026_03_21_05,Bernard Vaillant (volleyball),https://en.wikipedia.org/wiki/Bernard_Vaillant_(volleyball),Wikipedia,https://en.wikipedia.org,2026_03_21_05,Bernard Vaillant (26 March 1948 – 22 March 2019) was a Belgian volleyball player. He competed in the men's tournament at the 1968 Summer Olympics.[2]
Random wiki,2026_03_21_05,1921–1923 famine in Ukraine,https://en.wikipedia.org/wiki/1921%E2%80%931923_famine_in_Ukraine,Wikipedia,https://en.wikipedia.org,2026_03_21_05,"A severe famine occurred in Ukraine from 1921 to 1923,[1][2] mostly in the southern steppe region.[3] The number of fatalities is estimated between 200,000 and 1,000,000, but no systematic records were then made."
Random wiki,2026_03_21_05,Cargenbridge,https://en.wikipedia.org/wiki/Cargenbridge,Wikipedia,https://en.wikipedia.org,2026_03_21_05,"Cargenbridge is a village located in Dumfries and Galloway, United Kingdom, southwest of Dumfries.[2] It is in Troqueer parish, in the historic county of Kirkcudbrightshire."
Random wiki,2026_03_21_05,Suwandi Siswoyo,https://en.wikipedia.org/wiki/Suwandi_Siswoyo,Wikipedia,https://en.wikipedia.org,2026_03_21_05,"Suwandi Hadi Siswoyo (born 10 March 1972 in Gresik Regency) is an Indonesian football player and manager who previously plays as defender for Persegres Gresik, Petrokimia Putra, Persija Jakarta, PSM Makassar, Perseden Denpasar, Persib Bandung, PKT Bontang, Persita Tangerang, Mitra Kukar FC and the Indonesia national team.[1]"
