Who,scraped_datetime,Headline,Url,Site,Siteurl,Published,Description
Random wiki,2026_05_01_05,John Francis Marchment Middleton,https://en.wikipedia.org/wiki/John_Francis_Marchment_Middleton,Wikipedia,https://en.wikipedia.org,2026_05_01_05,"John Francis Marchmant Middleton (22 May 1921 – 27 February 2009)[1] was a British professor of anthropology in the United States, specializing in Africa. He was director of the International African Institute in 1973-74 and in 1980–81. His work on the Lugbara religion is considered a classic of African anthropology.[2]"
Random wiki,2026_05_01_05,2007–08 UEFA Futsal Cup,https://en.wikipedia.org/wiki/2007%E2%80%9308_UEFA_Futsal_Cup,Wikipedia,https://en.wikipedia.org,2026_05_01_05,"The 2007/08 UEFA Futsal Cup was a European futsal cup supported by the Union of European Football Associations (UEFA). It was held between 11 August 2007 and 27 April 2008. The final was held in Krylatskoye Sports Palace in Moscow, Russia and was won by Russia's Viz-Sinara Ekaterinburg."
Random wiki,2026_05_01_05,List of caves in Sri Lanka,https://en.wikipedia.org/wiki/List_of_caves_in_Sri_Lanka,Wikipedia,https://en.wikipedia.org,2026_05_01_05,"A cave or cavern is a natural void in the ground,[1][2] specifically a space large enough for a human to enter. Caves often form by the weathering of rock and often extend deeply underground. The word cave can also refer to much smaller openings such as sea caves, rock shelters, and grottos, though strictly speaking a cave is exogene, meaning it is deeper than its opening is wide,[3] and a rock shelter is endogene.[4]"
Random wiki,2026_05_01_05,Jett Rebel,https://en.wikipedia.org/wiki/Jett_Rebel,Wikipedia,https://en.wikipedia.org,2026_05_01_05,"Jelte Steven Tuinstra (born January 24, 1991, in The Hague), known professionally as Jett Rebel, is a Dutch singer-songwriter, composer, multi-instrumentalist, music producer and recording artist. The moniker Jett Rebel refers to a solo artist who performs live in different band formations in the Dutch music scene."
Random wiki,2026_05_01_05,Welfare fraud,https://en.wikipedia.org/wiki/Welfare_fraud,Wikipedia,https://en.wikipedia.org,2026_05_01_05,Welfare fraud is the act of illegally using state welfare systems by knowingly withholding or giving information to obtain more funds than would otherwise be allocated.
