Who,scraped_datetime,Headline,Url,Site,Siteurl,Published,Description
Random wiki,2026_06_02_06,Bradley Cardinale,https://en.wikipedia.org/wiki/Bradley_Cardinale,Wikipedia,https://en.wikipedia.org,2026_06_02_06,"Bradley Cardinale is an American ecologist, conservation biologist, academic and researcher. He is currently a professor in the Department of Ecosystem Science and Management at Penn State University."
Random wiki,2026_06_02_06,Haimen folk song,https://en.wikipedia.org/wiki/Haimen_folk_song,Wikipedia,https://en.wikipedia.org,2026_06_02_06,"Haimen folk song is popular in the sea sand area of Haimen. It is the production condition of local operas and also a kind of wu song. Haimen folk songs are divided into two kinds: one kind is impromptu folk songs, mostly appearing in the field of life or in the operation, freely into; The second is the narrative folk songs with lyrics having more than ten sentences, dozens of sentences, and even hundreds of words. The melody is beautiful, simple, pure, fresh, smooth with dense agrestic breath. It has distinctive local characteristics with a history of over 500 years. The Haimen veteran sir of Culture education, GuanJianGe,[1] gathered a large number haimen folk songs in his holiday, and selected 100 songs, then integrated Love Songs in Estuary (江口情歌), which published by the Summer university.[2]"
Random wiki,2026_06_02_06,Alfred Pippard,https://en.wikipedia.org/wiki/Alfred_Pippard,Wikipedia,https://en.wikipedia.org,2026_06_02_06,"Alfred John Sutton Pippard (6 April 1891 – 2 November 1969) was a British civil engineer and academic.  Pippard was the son of a carpenter and joiner and spent much of his early life helping his father on construction sites.  Initially supposed to follow his father into the family business, Pippard instead decided to study for a bachelor's degree in civil engineering at the University of Bristol, supporting himself with an Exhibition award.  Pippard worked for a Bristol based consulting engineer and for the Pontypridd and Rhondda Valley Joint Water Board in his early career. He also completed his master's degree during this period."
Random wiki,2026_06_02_06,Aaseji Nagar,https://en.wikipedia.org/wiki/Aaseji_Nagar,Wikipedia,https://en.wikipedia.org,2026_06_02_06,"Aaseji Nagar is a village located in the Phalodi tehsil of Jodhpur district, Rajasthan, India. It has a population of 308[2] according to the 2011 Indian National Population survey."
Random wiki,2026_06_02_06,Warren E. Hastings,https://en.wikipedia.org/wiki/Warren_E._Hastings,Wikipedia,https://en.wikipedia.org,2026_06_02_06,"Warren E. Hastings (July 3, 1887 – May 3, 1970) was an American locomotive engineer and politician."
