Who,scraped_datetime,Headline,Url,Site,Siteurl,Published,Description
Random wiki,2026_04_13_05,Shahnoza Kurbonova,https://en.wikipedia.org/wiki/Shahnoza_Kurbonova,Wikipedia,https://en.wikipedia.org,2026_04_13_05,Shahnoza Kurbonova (Uzbek: Shahnoza Qurbonova; born 1 May 2000) is an Uzbekistani footballer who plays as a forward. She has been a member of the Uzbekistan women's national football team.
Random wiki,2026_04_13_05,Orthaga castanealis,https://en.wikipedia.org/wiki/Orthaga_castanealis,Wikipedia,https://en.wikipedia.org,2026_04_13_05,"Orthaga castanealis is a species of snout moth in the genus Orthaga. It was described by George Hamilton Kenrick in 1907, and is known from Papua New Guinea (including Dinawa, the type location)."
Random wiki,2026_04_13_05,Ion Ioanid,https://en.wikipedia.org/wiki/Ion_Ioanid,Wikipedia,https://en.wikipedia.org,2026_04_13_05,"Ion Ioanid (28 March 1926 – 12 October 2003) was a Romanian dissident and writer. Ioanid was a political prisoner of the communist-led regime after World War II, who spent 12 years in prison and labor camps. He is best known for taking part in the 1953 Cavnic lead mine labor camp escape and for his book ""Give us each day our daily prison"" (Închisoarea noastră cea de toate zilele), a reference to the verse from the Christian Lord's Prayer. The book is a comprehensive recollection of his time spent in detention. He is considered a Romanian Solzhenitsyn,[citation needed] as his description of the communist detention regime in Romania is the most detailed one submitted by one of its victims."
Random wiki,2026_04_13_05,Zukelwa Cwaba,https://en.wikipedia.org/wiki/Zukelwa_Cwaba,Wikipedia,https://en.wikipedia.org,2026_04_13_05,"Zukelwa Cwaba (born 15 October 1984) is a South African netball player.[2][3]  She plays in the positions of GK, GD, GS and GA.[4] She is a member of the South Africa national netball team and has competed in the 2010 Commonwealth Games in Delhi, the 2007 World Netball Championships in Auckland and the 2011 World Netball Championships in Singapore. She has also participated in the 2011 World Netball Series in Liverpool, UK."
Random wiki,2026_04_13_05,Ask a Policeman (novel),https://en.wikipedia.org/wiki/Ask_a_Policeman_(novel),Wikipedia,https://en.wikipedia.org,2026_04_13_05,"Ask a Policeman is a 1955 detective novel by E.C.R. Lorac, the pen name of the British writer Edith Caroline Rivett.[1][2] It is the forty first in her long-running series featuring Chief Inspector MacDonald of Scotland Yard.[3] Published by the Collins Crime Club, the title references the popular music hall song Ask a Policeman."
