Who,scraped_datetime,Headline,Url,Site,Siteurl,Published,Description
Random wiki,2026_03_16_05,American immigration to Canada,https://en.wikipedia.org/wiki/American_immigration_to_Canada,Wikipedia,https://en.wikipedia.org,2026_03_16_05,"American immigration to Canada was a notable part of the social history of Canada. Over Canada's history various refugees and economic migrants from the United States would immigrate to Canada for a variety of reasons. Exiled Loyalists from the United States first came, followed by African-American refugees (fugitive slaves), economic migrants, and later draft evaders from the Vietnam War."
Random wiki,2026_03_16_05,Tom Howard (runner),https://en.wikipedia.org/wiki/Tom_Howard_(runner),Wikipedia,https://en.wikipedia.org,2026_03_16_05,Tom Howard (born 20 September 1948) is a Canadian long-distance runner. He competed in the marathon at the 1976 Summer Olympics.[1]
Random wiki,2026_03_16_05,Raymond Cattell,https://en.wikipedia.org/wiki/Raymond_Cattell,Wikipedia,https://en.wikipedia.org,2026_03_16_05,"Raymond Bernard Cattell (20 March 1905 – 2 February 1998) was a British-American psychologist, known for his psychometric research into intrapersonal psychological structure.[1][2] His work also explored the basic dimensions of personality and temperament, the range of cognitive abilities, the dynamic dimensions of motivation and emotion, the clinical dimensions of abnormal personality, patterns of group syntality and social behavior,[3] applications of personality research to psychotherapy and learning theory,[4] predictors of creativity and achievement,[5] and many multivariate research methods[6] including the refinement of factor analytic methods for exploring and measuring these domains.[7][8] Cattell authored, co-authored, or edited almost 60 scholarly books, more than 500 research articles, and over 30 standardized psychometric tests, questionnaires, and rating scales.[9][10] According to a widely cited ranking, Cattell was the 16th most eminent,[11] 7th most cited in the scientific journal literature,[12] and among the most productive psychologists of the 20th century.[13]"
Random wiki,2026_03_16_05,Cricket World Cup League 2,https://en.wikipedia.org/wiki/Cricket_World_Cup_League_2,Wikipedia,https://en.wikipedia.org,2026_03_16_05,
Random wiki,2026_03_16_05,Tom Tsuchiya,https://en.wikipedia.org/wiki/Tom_Tsuchiya,Wikipedia,https://en.wikipedia.org,2026_03_16_05,"Tom Tsuchiya also known as Norikazu (born August 3, 1972) is an American artist who creates public sculpture. He is best known for bronze sculptures for Major League Baseball and the National Football League.[1][2][3]  In 2016, Tom was commissioned by Josh Rooney, the Director of Sports & Entertainment at Matthews International to produce the National Baseball Hall of Fame and Museum plaque bas-reliefs for Ken Griffey Jr. and Mike Piazza.[4][5]"
