Who,scraped_datetime,Headline,Url,Site,Siteurl,Published,Description
Random wiki,2026_06_23_06,Muaro Sijunjung,https://en.wikipedia.org/wiki/Muaro_Sijunjung,Wikipedia,https://en.wikipedia.org,2026_06_23_06,"Muaro Sijunjung is a town and district in Sijunjung Regency, of West Sumatra province of Indonesia and it is the seat (capital) of Sijunjung Regency."
Random wiki,2026_06_23_06,Grupo Marsans,https://en.wikipedia.org/wiki/Grupo_Marsans,Wikipedia,https://en.wikipedia.org,2026_06_23_06,"Grupo Marsans was a private Spanish consortium mainly dedicated to tour operations. It had operations in Spain, France, Italy, Brazil, Mexico, Venezuela, and Argentina, as well as representations in Latin America. Grupo Marsans was a subsidiary of Autobuses Urbanos del Sur, S.A. It was based in Madrid, Spain.[1]"
Random wiki,2026_06_23_06,2009 Preakness Stakes,https://en.wikipedia.org/wiki/2009_Preakness_Stakes,Wikipedia,https://en.wikipedia.org,2026_06_23_06,"The 2009 Preakness Stakes was the 134th running of the Preakness Stakes, the second leg of horse racing's Triple Crown. The value of the race was $1,100,000 in stakes.[1] The race was sponsored by BlackBerry and hence officially was called BlackBerry Preakness Stakes.[1] The race took place on May 16, 2009. Post time was 6:19 p.m. EDT and was televised in the United States on the NBC television networks. 
The Maryland Jockey Club reported total attendance of 77,850, this is recorded as third highest on the list of American thoroughbred racing top attended events for North America in 2009.[2]"
Random wiki,2026_06_23_06,Lynmouth Lifeboat Station,https://en.wikipedia.org/wiki/Lynmouth_Lifeboat_Station,Wikipedia,https://en.wikipedia.org,2026_06_23_06,"Lynmouth Lifeboat Station was the base for Royal National Lifeboat Institution (RNLI) search and rescue operations at Lynmouth, Devon in England from 1869 until 1944. Its best-known action was in 1899 when the lifeboat was taken 15 miles (24 km) across Exmoor before being launched to assist a ship in trouble."
Random wiki,2026_06_23_06,Rapheephong Thapsuwan,https://en.wikipedia.org/wiki/Rapheephong_Thapsuwan,Wikipedia,https://en.wikipedia.org,2026_06_23_06,"Rapheephong Thapsuwan (Thai: รพีพงศ์ ทับสุวรรณ; born 11 May 1996), nicknamed Bright (Thai: ไบร์ท), is a Thai actor and model. He was a contracted actor for Channel 3 from 2018 to 2023 and currently works under GMMTV.[1] He is known for his role as Khun Yai in the series I Feel You Linger in the Air (2023).[2]"
