Who,scraped_datetime,Headline,Url,Site,Siteurl,Published,Description
Random wiki,2026_03_03_05,Gilmore Girls season 4,https://en.wikipedia.org/wiki/Gilmore_Girls_season_4,Wikipedia,https://en.wikipedia.org,2026_03_03_05,"The fourth season of Gilmore Girls, an American comedy drama television series, began airing on September 23, 2003, on The WB. After 22 episodes, the season concluded on May 18, 2004. The season aired on Tuesdays at 8:00 pm."
Random wiki,2026_03_03_05,Alfred Foster (mathematician),https://en.wikipedia.org/wiki/Alfred_Foster_(mathematician),Wikipedia,https://en.wikipedia.org,2026_03_03_05,"Alfred Leon Foster (1904-1994) was an American mathematician.[1] He was a professor at the University of California, Berkeley, from 1934 until 1971.[2] In 1932, he was an Invited Speaker at the ICM in Zürich."
Random wiki,2026_03_03_05,The Battle Is the Lord's,https://en.wikipedia.org/wiki/The_Battle_Is_the_Lord%27s,Wikipedia,https://en.wikipedia.org,2026_03_03_05,"""The Battle Is the Lord's"" is a song by American singer Yolanda Adams. It was the lead single from her 1993 album Save the World. It was named Song of the Year at the Stellar Awards in 1994, where it also won Adams the award for Traditional Solo Performance — Female.[1][2] A later live recording was included on her Grammy-nominated album Yolanda... Live in Washington (1996). The performance of this song was later featured on her DVD An Unforgettable Evening with Yolanda Adams in 2003."
Random wiki,2026_03_03_05,Great Falls Leader,https://en.wikipedia.org/wiki/Great_Falls_Leader,Wikipedia,https://en.wikipedia.org,2026_03_03_05,"The Great Falls Leader was a daily evening newspaper published in Great Falls, Montana.  Established in 1888, the Leader was one of two daily newspapers in the city for much of its history, competing with the morning Great Falls Tribune.  Publication of the Leader ended in 1969.[1]"
Random wiki,2026_03_03_05,Porto dos Gaúchos,https://en.wikipedia.org/wiki/Porto_dos_Ga%C3%BAchos,Wikipedia,https://en.wikipedia.org,2026_03_03_05,"Porto dos Gaúchos is a municipality in the state of Mato Grosso in the Central-West Region of Brazil.[2][3][4][5] The environmental conditions in Porto dos Gaúchos resemble those in other municipalities within the central-north region of the state. This area is experiencing rapid expansion driven primarily by unregulated cattle ranching, agriculture, and logging activities. Consequently, the municipality faces significant ecological challenges, including the degradation of permanent preservation areas, widespread burn-offs, and illegal deforestation. In early 2008, Porto dos Gaúchos was designated by the Ministry of the Environment as a priority municipality for initiatives aimed at preventing and combating deforestation in the Legal Amazon.[6]"
