Who,scraped_datetime,Headline,Url,Site,Siteurl,Published,Description
Random wiki,2026_04_26_05,Ottmar Scheuch,https://en.wikipedia.org/wiki/Ottmar_Scheuch,Wikipedia,https://en.wikipedia.org,2026_04_26_05,Ottmar Scheuch (born 29 November 1954) is a retired German football forward.[1][2]
Random wiki,2026_04_26_05,Amlan Borgohain,https://en.wikipedia.org/wiki/Amlan_Borgohain,Wikipedia,https://en.wikipedia.org,2026_04_26_05,Amlan Borgohain (born 25 April 1998) is an Indian sprinter who specializes in 100 m and 200 m events.[1]
Random wiki,2026_04_26_05,Bound by Ties of Blood and Affection,https://en.wikipedia.org/wiki/Bound_by_Ties_of_Blood_and_Affection,Wikipedia,https://en.wikipedia.org,2026_04_26_05,"Bound by Ties of Blood and Affection is the sixth studio album by the Santa Cruz, California-based hardcore punk band Good Riddance, released May 20, 2003 through Fat Wreck Chords. Like their previous two studio albums it was recorded at The Blasting Room in Fort Collins, Colorado with the production team of Bill Stevenson and Jason Livermore. It was their last album with drummer Dave Wagenschutz; following his departure the band slipped into a period of inactivity during which singer Russ Rankin formed Only Crime with Stevenson. Good Riddance would return in 2006 for My Republic with drummer Sean Sellers, who had previously been in the band from 1996 to 1999."
Random wiki,2026_04_26_05,Fengtun railway station,https://en.wikipedia.org/wiki/Fengtun_railway_station,Wikipedia,https://en.wikipedia.org,2026_04_26_05,"Fengtun railway station is a railway station located in Hata Township, Fuyu County, Harbin, Heilongjiang on the Qiqihar–Bei'an railway. The station was put into operation in January 1931.[1]"
Random wiki,2026_04_26_05,Matt Sinton,https://en.wikipedia.org/wiki/Matt_Sinton,Wikipedia,https://en.wikipedia.org,2026_04_26_05,"Matt Sinton (born 11 June 1976) is a New Zealand cyclist. He competed at the 2000 Summer Olympics in Sydney, in the Men's keirin and the men's track time trial.[1]"
