Who,scraped_datetime,Headline,Url,Site,Siteurl,Published,Description
Random wiki,2026_04_17_05,William Butler (missionary),https://en.wikipedia.org/wiki/William_Butler_(missionary),Wikipedia,https://en.wikipedia.org,2026_04_17_05,"Rev. William Butler, D.D. (January 30, 1818 – August 18, 1899) was an Irish-born U.S. Methodist Episcopal pioneer missionary. He was the founder of the Methodist Episcopal Mission in India, and afterward founder of the Mission in Mexico."
Random wiki,2026_04_17_05,André Preto,https://en.wikipedia.org/wiki/Andr%C3%A9_Preto,Wikipedia,https://en.wikipedia.org,2026_04_17_05,"André Matos Dias Pereira (born 18 April 1993), also known as Preto, is a Portuguese footballer who plays for Pevidém as a goalkeeper."
Random wiki,2026_04_17_05,George Matthew Dutcher,https://en.wikipedia.org/wiki/George_Matthew_Dutcher,Wikipedia,https://en.wikipedia.org,2026_04_17_05,"George Matthew Dutcher (October 16, 1874 – February 22, 1959) was an American historian and professor at Wesleyan University."
Random wiki,2026_04_17_05,"Auburn Tigers baseball, 1920–1929","https://en.wikipedia.org/wiki/Auburn_Tigers_baseball,_1920%E2%80%931929",Wikipedia,https://en.wikipedia.org,2026_04_17_05,Auburn Tigers baseball represents the Auburn University in college baseball at the NCAA Division I level.
Random wiki,2026_04_17_05,It's Gonna Be Fine,https://en.wikipedia.org/wiki/It%27s_Gonna_Be_Fine,Wikipedia,https://en.wikipedia.org,2026_04_17_05,"""It's Gonna Be Fine"" is a song written by Barry Mann and Cynthia Weil and performed by Glenn Yarbrough.  It reached #9 on the U.S. adult contemporary chart an #54 on the Billboard Hot 100 in 1965.[1]  It was featured on his 1965 album, It's Gonna Be Fine.[2]"
