Who,scraped_datetime,Headline,Url,Site,Siteurl,Published,Description
Random wiki,2026_06_24_05,Amber Richards,https://en.wikipedia.org/wiki/Amber_Richards,Wikipedia,https://en.wikipedia.org,2026_06_24_05,"Amber Marie Williams (November 17, 1957 – May 12, 1996),[1][2] better known by the stage name Amber Richards, was an American transgender female impersonator, performer, and television personality.[3] Richards was active in drag pageantry beginning in the late 1970s, competing in local and national pageants including Miss Gay America, Miss Continental, Miss Florida Female Impersonator, Miss Gay USofA, and Miss National. She won the Miss Florida FI pageant in 1985[4] and Miss Continental USA in 1991.[5][6] Richards appeared on daytime talk shows in the early 1990s and helped introduce an American audience to issues of gender identity, sexuality, and transgender rights at a time when members of the LGBTQ community were parodied and ridiculed."
Random wiki,2026_06_24_05,John De Camp House,https://en.wikipedia.org/wiki/John_De_Camp_House,Wikipedia,https://en.wikipedia.org,2026_06_24_05,"The John De Camp House is located in Scotch Plains, Union County, New Jersey, United States. The house was built in 1739 and was added to the National Register of Historic Places on December 4, 1973."
Random wiki,2026_06_24_05,Euxoullia,https://en.wikipedia.org/wiki/Euxoullia,Wikipedia,https://en.wikipedia.org,2026_06_24_05,Euxoullia is a genus of moths of the family Noctuidae.
Random wiki,2026_06_24_05,World Area Codes,https://en.wikipedia.org/wiki/World_Area_Codes,Wikipedia,https://en.wikipedia.org,2026_06_24_05,"The Bureau of Transportation Statistics (BTS), as part of the United States Department of Transportation (US DOT), maintains a list of U.S. state and country codes,[1] named World Area Codes (WAC)."
Random wiki,2026_06_24_05,Chris Arreola,https://en.wikipedia.org/wiki/Chris_Arreola,Wikipedia,https://en.wikipedia.org,2026_06_24_05,"Cristobal Arreola (born March 5, 1981) is an American former professional boxer who competed from 2003 to 2023. He challenged three times for the WBC heavyweight title in 2009, 2014 and 2016. He was ranked by BoxRec as the world's No.8 heavyweight at the conclusion of 2007 and as No.7 heavyweight from 2008 to 2010.[1]"
