Who,scraped_datetime,Headline,Url,Site,Siteurl,Published,Description
Random wiki,2026_06_11_05,The Hitchhiker's Guide to the Galaxy (TV series),https://en.wikipedia.org/wiki/The_Hitchhiker%27s_Guide_to_the_Galaxy_(TV_series),Wikipedia,https://en.wikipedia.org,2026_06_11_05,"The Hitchhiker's Guide to the Galaxy[1] is a BBC television adaptation of Douglas Adams' The Hitchhiker's Guide to the Galaxy which aired between 5 January and 9 February 1981 on BBC2 in the United Kingdom. The adaptation was released following the original radio series in 1978 and 1980, the first novel and double LP, in 1979, and the stage shows, in 1979 and 1980, making it the fifth iteration of the guide."
Random wiki,2026_06_11_05,Hedaginal,https://en.wikipedia.org/wiki/Hedaginal,Wikipedia,https://en.wikipedia.org,2026_06_11_05,Hedaginal also spelled as Hedginal is a village in the Sindhanur taluk of Raichur district in the Indian state of Karnataka. Hedaginal is located on the banks of Tungabhadra river. Hedaginal can be reached from Sindhanur via Olaballari and from Jawalagera via Timmapur.
Random wiki,2026_06_11_05,Johannes Symonis Hasprois,https://en.wikipedia.org/wiki/Johannes_Symonis_Hasprois,Wikipedia,https://en.wikipedia.org,2026_06_11_05,"Johannes Symonis (Jehan Simon) Hasprois[1] (died 1428) was a French composer originally from Arras. Four of his works of music survive in four different manuscripts, and he may also have written a treatise on astrology."
Random wiki,2026_06_11_05,Lisa Merkel,https://en.wikipedia.org/wiki/Lisa_Merkel,Wikipedia,https://en.wikipedia.org,2026_06_11_05,Lisa Merkel (born 20 January 2003) is a German cross country and long-distance runner.[1]
Random wiki,2026_06_11_05,SDBA,https://en.wikipedia.org/wiki/SDBA,Wikipedia,https://en.wikipedia.org,2026_06_11_05,The SDBA (Special Duty Oxygen Breathing Apparatus) is a type of frogman's rebreather breathing set. Many of the world's navies and army marine corps have used it since 1971.
