Who,scraped_datetime,Headline,Url,Site,Siteurl,Published,Description
Random wiki,2026_03_11_05,Gaute Storaas,https://en.wikipedia.org/wiki/Gaute_Storaas,Wikipedia,https://en.wikipedia.org,2026_03_11_05,"Gaute Storaas (born 20 August 1959) is a Norwegian jazz musician (bass) and composer,[1][2] and the older brother of jazz pianist Vigleik Storaas.[3]"
Random wiki,2026_03_11_05,Ivan Vyhovsky,https://en.wikipedia.org/wiki/Ivan_Vyhovsky,Wikipedia,https://en.wikipedia.org,2026_03_11_05,"Ivan Vyhovsky (Ruthenian: Іоан Виговский / Іоан Виговскій / Іоан(ъ) Выговскій /  Иоан Виговс(ъ)кий;[2] Ukrainian: Іван Виговський; Polish: Iwan Wyhowski / Jan Wyhowski;  date of birth unknown, died 1664), served as hetman of the Zaporozhian Host (1657-1659), leading the Cossack Hetmanate during the Russo-Polish War (1654–1667)."
Random wiki,2026_03_11_05,35th Combat Aviation Brigade (United States),https://en.wikipedia.org/wiki/35th_Combat_Aviation_Brigade_(United_States),Wikipedia,https://en.wikipedia.org,2026_03_11_05,"The 35th Combat Aviation Brigade is a subordinate command of the 35th Infantry Division (Missouri Army National Guard), located in Sedalia, Missouri."
Random wiki,2026_03_11_05,Amir Bekandeh,https://en.wikipedia.org/wiki/Amir_Bekandeh,Wikipedia,https://en.wikipedia.org,2026_03_11_05,"Amir Bekandeh (Persian: اميربكنده)[a] is a village in Hajji Bekandeh-ye Khoshk-e Bijar Rural District[4] of Khoshk-e Bijar District in Rasht County, Gilan province, Iran."
Random wiki,2026_03_11_05,Kaigake-ike Dam,https://en.wikipedia.org/wiki/Kaigake-ike_Dam,Wikipedia,https://en.wikipedia.org,2026_03_11_05,Kaigake-ike Dam is an earthfill dam located in Shiga prefecture in Japan. The dam is used for irrigation. The catchment area of the dam is 0.8 km2. The dam impounds about 3  ha of land when full and can store 260 thousand cubic meters of water. The construction of the dam was completed in 1954.[1]
