Who,scraped_datetime,Headline,Url,Site,Siteurl,Published,Description
Random wiki,2026_03_23_05,Lauren Corrao,https://en.wikipedia.org/wiki/Lauren_Corrao,Wikipedia,https://en.wikipedia.org,2026_03_23_05,"Lauren Corrao is an American television executive. She became Executive Vice President of Original Programming and Development at Freeform in 2019.[1] She is a former programming executive for Comedy Central, where she oversaw The Daily Show With John Stewart and The Colbert Report.[1][2][3] She was also formerly co-president of Tornante TV and Vice President of MTV.[1]"
Random wiki,2026_03_23_05,Ben Johnson (basketball),https://en.wikipedia.org/wiki/Ben_Johnson_(basketball),Wikipedia,https://en.wikipedia.org,2026_03_23_05,"Benjamin Johnson (born December 23, 1980) is an American college basketball coach. He played basketball for the Northwestern Wildcats and Golden Gophers before becoming an assistant coach for several major college programs.[1] From 2021–2025, he served as the head coach of the Minnesota Golden Gophers."
Random wiki,2026_03_23_05,WINdows KwikStat,https://en.wikipedia.org/wiki/WINdows_KwikStat,Wikipedia,https://en.wikipedia.org,2026_03_23_05,WINKS Statistical Data Analytics(SDA) & Graphs is a statistical analysis software package.
Random wiki,2026_03_23_05,Boy in the Moon,https://en.wikipedia.org/wiki/Boy_in_the_Moon,Wikipedia,https://en.wikipedia.org,2026_03_23_05,"""Boy in the Moon"" is a song from New Zealand singer Margaret Urlich. The song was released in July 1992 as the lead single from her second studio album, Chameleon Dreams. The song peaked at number 21 in Australia and number 9 in New Zealand.[2]"
Random wiki,2026_03_23_05,Omar Nasiri,https://en.wikipedia.org/wiki/Omar_Nasiri,Wikipedia,https://en.wikipedia.org,2026_03_23_05,"Omar Nasiri (born 1960s) is the pseudonym of a Belgian spy of Moroccan origin who infiltrated al-Qaeda, attending training camps in Afghanistan and passing information to the UK and French external intelligence services, the DGSE. He claims in an exclusive interview presented on the BBC's Newsnight programme on 16 November 2006 that the UK intelligence services were warned in the mid-1990s about the threat posed by al-Qaeda, but failed to act quickly enough. He also claims that Ibn al-Shaykh al-Libi deliberately gave interrogators acting on behalf of the United States false information in order to encourage the USA to overthrow Saddam Hussein, thus allowing al-Qaeda to use Iraq as a jihadist base."
