Who,scraped_datetime,Headline,Url,Site,Siteurl,Published,Description
Random wiki,2026_05_25_05,R. T. Kendall,https://en.wikipedia.org/wiki/R._T._Kendall,Wikipedia,https://en.wikipedia.org,2026_05_25_05,"Robert Tillman Kendall (born July 13, 1935) is a Christian writer, speaker, and teacher who was pastor at Westminster Chapel for 25 years. He is author of more than 50 books, including Total Forgiveness.[1] Kendall was part of the Word, Spirit, Power team, a non-denominational charismatic ministry.[2]"
Random wiki,2026_05_25_05,Agnes Kafula,https://en.wikipedia.org/wiki/Agnes_Kafula,Wikipedia,https://en.wikipedia.org,2026_05_25_05,Agnes Mpingana Kafula (born 1 November 1955) is a Namibian politician who has served as mayor of Windhoek from November 2012[1] to December 2014.[2] She is a survivor of the Cassinga massacre of 4 May 1978.[3]
Random wiki,2026_05_25_05,Gertrude Tyrrell,https://en.wikipedia.org/wiki/Gertrude_Tyrrell,Wikipedia,https://en.wikipedia.org,2026_05_25_05,Gertrude Tyrrell (died 28 May 1541) was a 16th-century English noblewoman.
Random wiki,2026_05_25_05,Tears of the Dragon (TV series),https://en.wikipedia.org/wiki/Tears_of_the_Dragon_(TV_series),Wikipedia,https://en.wikipedia.org,2026_05_25_05,"Tears of the Dragon (Korean: 용의 눈물) is a South Korean historical drama television series. It aired on KBS1 from November 24, 1996 to May 31, 1998 for 159 episodes. The series spans from the foundation of Joseon to the reign of King Sejong. It's considered one of the best historical dramas in South Korea, reaching a viewership rating of 49%. It is also the first series based on historical researches on Prime Minister Jeong Do-jeon.[1]"
Random wiki,2026_05_25_05,Emma Wright,https://en.wikipedia.org/wiki/Emma_Wright,Wikipedia,https://en.wikipedia.org,2026_05_25_05,"Emma Wright (born November 16, 1996) is a Canadian water polo player.[1][2] She plays for the Canadian national women's water polo team[3] and played collegiately at the University of California, Berkeley.[4]"
