Who,scraped_datetime,Headline,Url,Site,Siteurl,Published,Description
Random wiki,2026_06_26_05,The Way of the Fist,https://en.wikipedia.org/wiki/The_Way_of_the_Fist,Wikipedia,https://en.wikipedia.org,2026_06_26_05,"The Way of the Fist is the debut studio album by American heavy metal band Five Finger Death Punch, released on July 31, 2007. The album sold 3,800 copies in its first week of release. The Way of the Fist made its Billboard 200 debut on August 18, 2007, at No. 199 and peaked at No. 107. It has been certified Gold for selling in excess of 500,000 copies as of April 13, 2011.[4] This is the band's only release with guitarist Darrell Roberts."
Random wiki,2026_06_26_05,Tomáš Kopecký (cyclist),https://en.wikipedia.org/wiki/Tom%C3%A1%C5%A1_Kopeck%C3%BD_(cyclist),Wikipedia,https://en.wikipedia.org,2026_06_26_05,"Tomáš Kopecký (born 8 April 2000) is a Czech road and former cyclo-cross cyclist, who currently rides for UCI ProTeam Unibet Rose Rockets.[3][4] His brother Matyáš and sister Julia are also professional cyclists."
Random wiki,2026_06_26_05,Abdolreza Rahmani Fazli,https://en.wikipedia.org/wiki/Abdolreza_Rahmani_Fazli,Wikipedia,https://en.wikipedia.org,2026_06_26_05,Abdolreza Rahmani Fazli (Persian: عبدالرضا رحمانی فضلی; born 1959) is an Iranian conservative politician who has served as the ambassador of Iran to China in the Government of Masoud Pezeshkian since 21 May 2025. He was also Minister of Interior in Hassan Rouhani's government and the president of  the Supreme Audit Court from 2008 to 2013.
Random wiki,2026_06_26_05,Michael Dobson (footballer),https://en.wikipedia.org/wiki/Michael_Dobson_(footballer),Wikipedia,https://en.wikipedia.org,2026_06_26_05,"Michael William Dobson (born 9 April 1981) is an English former professional footballer, who made over 170 appearances in the Football League for Brentford as a full back. He also played League football for Walsall and Reading and was nicknamed ""Dobbo"".[3]"
Random wiki,2026_06_26_05,Scopelopsis,https://en.wikipedia.org/wiki/Scopelopsis,Wikipedia,https://en.wikipedia.org,2026_06_26_05,"Scopelopsis multipunctatus, the multispotted lanternfish, is a species of lanternfish. This species grows to a length of 9.5 cm (3.7 in).[1]"
