Who,scraped_datetime,Headline,Url,Site,Siteurl,Published
ABC History,2025_12_27_05,The assassination of a leader returned from exile that shook Pakistan,https://www.abc.net.au/news/2025-12-27/today-history-december-27-benazir-bhutto-assasination-pakistan/106165790,ABC,https://www.abc.net.au,2025_12_25_00
ABC History,2025_12_27_05,Family unearths story of Australian cricket's 'girl Bradman' Hazel Pritchard,https://www.abc.net.au/news/2025-12-27/cricket-hazel-pritchard-girl-bradman-women-cricket-test-1937/106100096,ABC,https://www.abc.net.au,2025_12_25_00
ABC History,2025_12_27_05,The Boxing Day deal that set in motion sport's most infamous curse,https://www.abc.net.au/news/2025-12-26/today-in-history-babe-ruth-is-sold-from-red-sox-to-the-yankees/106135072,ABC,https://www.abc.net.au,2025_12_25_00
ABC History,2025_12_27_05,"Before Harry fled the royals there was Edward, who traded his title for love",https://www.abc.net.au/news/2025-12-26/royal-family-prince-edward-history-love-harry/105522404,ABC,https://www.abc.net.au,2025_12_25_00
ABC History,2025_12_27_05,'She Trapped the Sun': Inside the world's first solar house,https://www.abc.net.au/news/2025-12-24/dover-sun-house-solar-energy-history/106116344,ABC,https://www.abc.net.au,2025_12_25_00
