Who,scraped_datetime,Headline,Url,Site,Siteurl,Published
ABC History,2026_03_16_14,"This week in history quiz: COVID cruise ships, Neighbours launches and walking in space",https://www.abc.net.au/news/2026-03-16/this-week-in-history-quiz-march-16/106405844,ABC,https://www.abc.net.au,2025_12_25_00
ABC History,2026_03_16_14,Mary and Fred's love story: How a girl from Hobart met a prince and became queen,https://www.abc.net.au/news/2026-03-14/mary-and-fred-love-story-danish-royals-australian-tour/106451850,ABC,https://www.abc.net.au,2025_12_25_00
ABC History,2026_03_16_14,"ABC 50/50 quiz: Test your knowledge of 70s rock, Pixar and our national anthem",https://www.abc.net.au/news/2026-03-14/abc-5050-quiz-march-14/106447328,ABC,https://www.abc.net.au,2025_12_25_00
ABC History,2026_03_16_14,Ancestral remains return to Country after a century in a British museum,https://www.abc.net.au/news/2026-03-13/nsw-ancestor-remains-uncle-returned-county-from-england/106440590,ABC,https://www.abc.net.au,2025_12_25_00
ABC History,2026_03_16_14,Iconic Australian-made pinball machines preserved for generations to come,https://www.abc.net.au/news/2026-03-12/pinball-machines-collected-nfsa-hankin/105971386,ABC,https://www.abc.net.au,2025_12_25_00
