Who,scraped_datetime,Headline,Url,Site,Siteurl,Published
ABC History,2026_03_30_05,Quiz: Can you go back in time and nail our quiz?,https://www.abc.net.au/news/2026-03-30/this-week-in-history-quiz/106508596,ABC,https://www.abc.net.au,2025_12_25_00
ABC History,2026_03_30_05,Vital Aboriginal records saved in the 70s by an astute WA archivist,https://www.abc.net.au/news/2026-03-29/archivists-life-work-celebrated-western-australia/106504878,ABC,https://www.abc.net.au,2025_12_25_00
ABC History,2026_03_30_05,"After 80 years, sleuths have unearthed a secret stash of early art and reunited them with family",https://www.abc.net.au/news/2026-03-29/art-mystery-solved-after-decades-hidden/106486356,ABC,https://www.abc.net.au,2025_12_25_00
ABC History,2026_03_30_05,Why the 'perfect pair' of jeans remains an elusive concept,https://www.abc.net.au/news/2026-03-29/brief-history-of-denim-perfect-pair-jeans-elusive/106495324,ABC,https://www.abc.net.au,2025_12_25_00
ABC History,2026_03_30_05,"From confectionery to boot polish, showbags were originally free sample bags",https://www.abc.net.au/news/2026-03-29/show-bags-sideshow-alley-history-australian-tradition/106405158,ABC,https://www.abc.net.au,2025_12_25_00
