Who,scraped_datetime,Headline,Url,Site,Siteurl,Published
ABC History,2026_07_17_06,Ancestral remains returned to Polynesian island after 143 years in museum,https://www.abc.net.au/news/2026-07-16/repatriation-of-rapa-nui-remains-australian-museum-easter-island/106917256,ABC,https://www.abc.net.au,2025_12_25_00
ABC History,2026_07_17_06,Worn-down 'jewel' needs some love ahead of World Heritage Bid,https://www.abc.net.au/news/2026-07-13/walhalla-infrastructure-concerns-world-heritage-bid/106896812,ABC,https://www.abc.net.au,2025_12_25_00
ABC History,2026_07_17_06,History quiz: Test your recall on Tay Tay and the Tour de France,https://www.abc.net.au/news/2026-07-13/this-week-in-history-quiz-july-13/106899384,ABC,https://www.abc.net.au,2025_12_25_00
ABC History,2026_07_17_06,Football homecoming brings 30yo tradition back to life,https://www.abc.net.au/news/2026-07-12/ensay-football-homecoming-revives-decades-old-legacy/106899404,ABC,https://www.abc.net.au,2025_12_25_00
ABC History,2026_07_17_06,Frozen thermometers and drunk scientists: Inside Shackleton's Antarctic expedition,https://www.abc.net.au/news/2026-07-12/rare-glimpse-into-shackleton-discovery-antarctic-expedition/106488464,ABC,https://www.abc.net.au,2025_12_25_00
