Who,scraped_datetime,Headline,Url,Site,Siteurl,Published
ABC History,2026_07_21_06,"Once known as Little Beirut, stories of Adelaide's historical corner uncovered",https://www.abc.net.au/news/2026-07-20/play-revives-adelaide-street-lost-history/106921994,ABC,https://www.abc.net.au,2025_12_25_00
ABC History,2026_07_21_06,Try this week's history quiz (we made it an easy one),https://www.abc.net.au/news/2026-07-20/this-week-in-history-quiz-july-20/106922730,ABC,https://www.abc.net.au,2025_12_25_00
ABC History,2026_07_21_06,Ode to A Big Country: Rodeo,https://www.abc.net.au/news/rural/programs/landline/2026-07-19/ode-to-a-big-country-rodeo/106927910,ABC,https://www.abc.net.au,2025_12_25_00
ABC History,2026_07_21_06,The Houdini of Boggo Road escaped the prison in 1946. He shouldn't have taken a friend,https://www.abc.net.au/news/2026-07-19/boggo-road-gaol-halliday-1946-escape-boy-swallows-universe/106885768,ABC,https://www.abc.net.au,2025_12_25_00
ABC History,2026_07_21_06,Activists fight to save historic home earmarked for demolition,https://www.abc.net.au/news/2026-07-18/saving-frank-street-history-housing/106916448,ABC,https://www.abc.net.au,2025_12_25_00
