Who,scraped_datetime,Headline,Url,Site,Siteurl,Published
ABC History,2026_04_26_05,Inside Chernobyl is a toxic world where frogs have turned black,https://www.abc.net.au/news/2026-04-26/chernobyl-40-nuclear-explosion-power-plant-nature-survives/106588662,ABC,https://www.abc.net.au,2025_12_25_00
ABC History,2026_04_26_05,Scrapped anti-whaling ship bought for $10 makes conservation comeback,https://www.abc.net.au/news/2026-04-25/mv-steve-irwin-sets-sail-conservation-comeback/106600658,ABC,https://www.abc.net.au,2025_12_25_00
ABC History,2026_04_26_05,'Carry the hope': Thousands gather for Anzac Day service in Canberra,https://www.abc.net.au/news/2026-04-25/thousands-gather-at-australian-war-memorial-for-anzac-day/106601498,ABC,https://www.abc.net.au,2025_12_25_00
ABC History,2026_04_26_05,The donkey marching for the memory of all animals that serve in war,https://www.abc.net.au/news/2026-04-25/anzac-donkey-animals-lost-to-war-mount-gambier/106602120,ABC,https://www.abc.net.au,2025_12_25_00
ABC History,2026_04_26_05,108yo and 103yo WWII veterans meet after more than 80 years,https://www.abc.net.au/news/2026-04-25/sa-wwii-veterans-meet-after-more-than-80-years/106590394,ABC,https://www.abc.net.au,2025_12_25_00
