Who,scraped_datetime,Headline,Url,Site,Siteurl,Published
ABC History,2026_06_14_05,The sword that links feared pirates to Britain's greatest naval hero,https://www.abc.net.au/news/science/2026-06-13/moro-kris-sword-admiral-lord-horatio-nelson-maritime-history/106748410,ABC,https://www.abc.net.au,2025_12_25_00
ABC History,2026_06_14_05,Coastal town hires its own film crew to capture life in 2026,https://www.abc.net.au/news/2026-06-13/agnes-water-films-documentary-to-record-life-in-2026/106786712,ABC,https://www.abc.net.au,2025_12_25_00
ABC History,2026_06_14_05,This man bought the land stolen from his Indigenous ancestors,https://www.abc.net.au/news/2026-06-12/restoration-sets-record-straight/106700030,ABC,https://www.abc.net.au,2025_12_25_00
ABC History,2026_06_14_05,School told to find and exhume graves ahead of planned development,https://www.abc.net.au/news/2026-06-10/deloraine-cemetery-catholic-church-graves-tasmania/106733696,ABC,https://www.abc.net.au,2025_12_25_00
ABC History,2026_06_14_05,The criticism Marc Fennell always gets for Stuff the British Stole,https://www.abc.net.au/news/2026-06-09/criticism-marc-fennell-always-gets-for-stuff-the-british-stole/106705240,ABC,https://www.abc.net.au,2025_12_25_00
