Who,scraped_datetime,Headline,Url,Site,Siteurl,Published
ABC History,2026_02_14_05,This pile of 200 blankets tells the story of country WA's only wool mill,https://www.abc.net.au/news/2026-02-13/albany-woollen-mill-in-albany-celebrates-101-years/106322356,ABC,https://www.abc.net.au,2025_12_25_00
ABC History,2026_02_14_05,"This house has stood for 150 years, but its future is uncertain",https://www.abc.net.au/news/2026-02-13/struan-house-future-uncertain-amid-research-centre-rebuild/106323358,ABC,https://www.abc.net.au,2025_12_25_00
ABC History,2026_02_14_05,Historic 'nation-building' bridges lost during Victorian bushfires,https://www.abc.net.au/news/2026-02-11/historical-high-country-rail-trail-bridges-destroyed-by-fire/106312604,ABC,https://www.abc.net.au,2025_12_25_00
ABC History,2026_02_14_05,Quiz: How well do you know this week in history?,https://www.abc.net.au/news/2026-02-09/this-week-in-history-quiz/106276538,ABC,https://www.abc.net.au,2025_12_25_00
ABC History,2026_02_14_05,Gold prospectors of bygone era create fond memories for photography duo,https://www.abc.net.au/news/2026-02-08/photographers-remember-bygone-era-wa-gold-prospecting/106299710,ABC,https://www.abc.net.au,2025_12_25_00
