Who,scraped_datetime,Headline,Url,Site,Siteurl,Published
ABC History,2026_01_28_05,'It's going to be catastrophic': The inside story of the Challenger disaster,https://www.abc.net.au/news/science/2026-01-28/space-shuttle-challenger-disaster-nasa-explosion-video-engineers/106162902,ABC,https://www.abc.net.au,2025_12_25_00
ABC History,2026_01_28_05,Bradman still setting records as baggy green fetches top price,https://www.abc.net.au/news/2026-01-27/bradman-baggy-green-fetches-record-price-at-auction/106272464,ABC,https://www.abc.net.au,2025_12_25_00
ABC History,2026_01_28_05,"Call for memorial to Beaumont children, 60 years after they vanished",https://www.abc.net.au/news/2026-01-26/beaumont-children-missing-60-years-today-memorial/106269224,ABC,https://www.abc.net.au,2025_12_25_00
ABC History,2026_01_28_05,1960s films restored in hope of enticing new migrants to regional Australia,https://www.abc.net.au/news/2026-01-26/nfsa-restoration-of-mount-gambier-life-in-australia/106117106,ABC,https://www.abc.net.au,2025_12_25_00
ABC History,2026_01_28_05,"Islands rich in history, marine life and debate about their names",https://www.abc.net.au/news/2026-01-26/history-of-five-islands-nature-reserve-in-nsw-illawarra-region/106050352,ABC,https://www.abc.net.au,2025_12_25_00
