Who,scraped_datetime,Headline,Url,Site,Siteurl,Published
ABC History,2026_07_02_05,What Matthew Flinders and George Bass can teach us about male friendship,https://www.abc.net.au/news/2026-07-02/matthew-flinders-australian-history/106840188,ABC,https://www.abc.net.au,2025_12_25_00
ABC History,2026_07_02_05,Today in history: NT town of Katherine gazetted 100 years ago,https://www.abc.net.au/news/2026-07-01/100-years-since-katherine-gazetted/106860040,ABC,https://www.abc.net.au,2025_12_25_00
ABC History,2026_07_02_05,Volunteers say National Trust of SA warned them against speaking publicly,https://www.abc.net.au/news/2026-07-01/national-trust-sa-volunteers-silenced-ahead-of-inquiry/106839450,ABC,https://www.abc.net.au,2025_12_25_00
ABC History,2026_07_02_05,"1,000kg of CSIRO archives on Australia's wool history returned",https://www.abc.net.au/news/2026-06-29/csiro-merino-sheep-archives-returned-australia/106840580,ABC,https://www.abc.net.au,2025_12_25_00
ABC History,2026_07_02_05,Ageing 'Nashos' call for priority as all veterans get equal access to health benefits,https://www.abc.net.au/news/2026-06-29/veterans-to-get-equal-treatment-for-health-issues/106813258,ABC,https://www.abc.net.au,2025_12_25_00
