Who,scraped_datetime,Headline,Url,Site,Siteurl,Published
ABC History,2026_05_12_05,A billionaire mined their land without permission. Now judgment day is looming,https://www.abc.net.au/news/2026-05-11/andrew-forrest-fortescue-yindjibarndi-compensation-decision/106640484,ABC,https://www.abc.net.au,2025_12_25_00
ABC History,2026_05_12_05,Quiz: How much did Michael Jordan's signed Air Nike 1s sell for in 2020?,https://www.abc.net.au/news/2026-05-11/this-week-in-history-quiz-may-11/106644708,ABC,https://www.abc.net.au,2025_12_25_00
ABC History,2026_05_12_05,The refurbished cider mill perfomed well for its first crush in more than 100 years.,https://www.abc.net.au/news/2026-05-10/old-cider-mill-refurbished-in-braidwood-by-ned-bott/106652050,ABC,https://www.abc.net.au,2025_12_25_00
ABC History,2026_05_12_05,Victorian-era cider mill crushes first apples in more than 100 years,https://www.abc.net.au/news/2026-05-10/century-old-cider-mill-restored/106651600,ABC,https://www.abc.net.au,2025_12_25_00
ABC History,2026_05_12_05,"The 'magnificent' mansion that housed movie stars, hippies and refugees",https://www.abc.net.au/news/2026-05-10/melbourne-mansion-labassa-housed-movie-stars-hippies-refugees/106658828,ABC,https://www.abc.net.au,2025_12_25_00
