Who,scraped_datetime,Headline,Url,Site,Siteurl,Published
ABC History,2026_05_24_05,Trump revives centuries-old doctrine that shaped US-Cuba relations,https://www.abc.net.au/news/2026-05-24/trump-revives-monroe-doctrine-history/106711966,ABC,https://www.abc.net.au,2025_12_25_00
ABC History,2026_05_24_05,Albany's hidden WWII fuel tanks transformed into global street art gallery,https://www.abc.net.au/news/2026-05-23/wwii-fuel-tank-street-art-great-southern-albany/106710754,ABC,https://www.abc.net.au,2025_12_25_00
ABC History,2026_05_24_05,'Arc de Trump' is one step closer to being built. Here's why it's controversial,https://www.abc.net.au/news/2026-05-22/arc-de-trump-monument-one-step-closer-to-being-built/106710574,ABC,https://www.abc.net.au,2025_12_25_00
ABC History,2026_05_24_05,Berlin approves bid to host Olympics on 100th anniversary of Nazi-run Games,https://www.abc.net.au/news/2026-05-22/berlin-approves-bid-to-host-2036-olympics/106709702,ABC,https://www.abc.net.au,2025_12_25_00
ABC History,2026_05_24_05,Dismay over 150-year-old house being reduced to rubble,https://www.abc.net.au/news/2026-05-22/1870s-launceston-tasmania-house-demolished/106699962,ABC,https://www.abc.net.au,2025_12_25_00
