Who,scraped_datetime,Headline,Url,Site,Siteurl,Published
ABC Matt Liddy,2025_09_20_05,"From wild to workable, 23 big ideas for boosting Australia's productivity",https://www.abc.net.au/news/2025-08-18/big-ideas-productivity-economic-reform-roundtable/105629070,ABC,https://www.abc.net.au,2025_08_24_22
ABC Matt Liddy,2025_09_20_05,Israel's approach to Iran has its origins in letter bombs sent to German scientists,https://www.abc.net.au/news/2025-06-27/israel-vow-to-change-middle-east-reverberates-across-map/105435308,ABC,https://www.abc.net.au,2025_07_07_05
ABC Matt Liddy,2025_09_20_05,The US helped start Iran's nuclear program — but now wants to end it,https://www.abc.net.au/news/2025-07-02/iran-us-relationship-history/105457754,ABC,https://www.abc.net.au,2025_07_01_18
ABC Matt Liddy,2025_09_20_05,'Third party' vote looks set to beat Coalition,https://www.abc.net.au/news/2025-05-10/election-results-independents-rising-charts/105267162,ABC,https://www.abc.net.au,2025_05_12_05
ABC Matt Liddy,2025_09_20_05,The Liberals' suburban wipe-out has complicated leadership discussions,https://www.abc.net.au/news/2025-05-06/election-map-cities-liberal-leadership/105255218,ABC,https://www.abc.net.au,2025_05_05_19
ABC Matt Liddy,2025_09_20_05,"Where things went right for Labor, and very wrong for the Coalition",https://www.abc.net.au/news/2025-05-04/election-result-map-how-labor-won/105208988,ABC,https://www.abc.net.au,2025_05_04_02
ABC Matt Liddy,2025_09_20_05,This triangle helps explain a titanic shift in how Australia votes,https://www.abc.net.au/news/2025-04-24/election-data-rise-independents-major-party-drift/105144918,ABC,https://www.abc.net.au,2025_04_23_23
ABC Matt Liddy,2025_09_20_05,Stock market tracker: See how ASX and US stocks are faring under Trump,https://www.abc.net.au/news/2025-04-08/share-market-tracker-asx-us-sp500-aussie-dollar/105148536,ABC,https://www.abc.net.au,2025_04_08_04
ABC Matt Liddy,2025_09_20_05,Watch live: Cyclone Alfred webcam videos show wild weather,https://www.abc.net.au/news/2025-03-08/cyclone-alfred-webcams-videos/105023954,ABC,https://www.abc.net.au,2025_03_11_23
ABC Matt Liddy,2025_09_20_05,Track wind speeds and rainfall live from Cyclone Alfred,https://www.abc.net.au/news/2025-03-07/cyclone-alfred-wind-speeds-and-rainfall/105020014,ABC,https://www.abc.net.au,2025_03_10_23
