Who,scraped_datetime,Headline,Url,Site,Siteurl,Published
Al Jazeera,2025_12_31_05,All the countries Israel attacked in 2025: Animated map,https://www.aljazeera.com/news/longform/2025/12/29/all-the-countries-israel-attacked-in-2025-animated-map,Al Jazeera,https://www.aljazeera.com,2025_12_29_00
Al Jazeera,2025_12_31_05,Christmas under occupation: Israeli attacks against Palestinian Christians,https://www.aljazeera.com/news/2025/12/25/christmas-under-occupation-israeli-attacks-against-palestinian-christians,Al Jazeera,https://www.aljazeera.com,2025_12_25_00
Al Jazeera,2025_12_31_05,News Quiz: Can you locate the biggest stories from 2025?,https://www.aljazeera.com/news/longform/2025/12/23/can-you-locate-the-biggest-stories-from-2025,Al Jazeera,https://www.aljazeera.com,2025_12_23_00
Al Jazeera,2025_12_31_05,"Which countries, besides Russia, have assets frozen by the EU?",https://www.aljazeera.com/news/2025/12/19/which-countries-besides-russia-have-assets-frozen-by-the-eu,Al Jazeera,https://www.aljazeera.com,2025_12_19_00
Al Jazeera,2025_12_31_05,How many times has Israel violated the Gaza ceasefire? Here are the numbers,https://www.aljazeera.com/news/2025/11/11/how-many-times-has-israel-violated-the-gaza-ceasefire-here-are-the-numbers,Al Jazeera,https://www.aljazeera.com,2025_11_11_00
