Who,scraped_datetime,Headline,Url,Site,Siteurl,Published
Al Jazeera,2025_08_29_05,"Behind Pakistan’s repeated floods: Melting glaciers, depleted forests",https://www.aljazeera.com/news/2025/8/28/behind-pakistans-repeated-floods-melting-glaciers-depleted-forests,Al Jazeera,https://www.aljazeera.com,2025_08_28_00
Al Jazeera,2025_08_29_05,How many school shootings have there been in the US in 2025?,https://www.aljazeera.com/news/2025/8/28/how-many-school-shootings-have-there-been-in-the-us-in-2025,Al Jazeera,https://www.aljazeera.com,2025_08_28_00
Al Jazeera,2025_08_29_05,Starvation strategy: How Israel created famine in Gaza,https://www.aljazeera.com/news/2025/8/27/starvation-strategy-how-israel-created-famine-in-gaza,Al Jazeera,https://www.aljazeera.com,2025_08_27_00
Al Jazeera,2025_08_29_05,Why does the temperature feel hotter than the forecast says?,https://www.aljazeera.com/news/2025/8/26/why-does-the-temperature-feel-hotter-than-the-forecast-says,Al Jazeera,https://www.aljazeera.com,2025_08_26_00
Al Jazeera,2025_08_29_05,When and why has the National Guard been deployed in the US before?,https://www.aljazeera.com/news/2025/8/25/when-and-why-has-the-national-guard-been-deployed-in-the-us-before,Al Jazeera,https://www.aljazeera.com,2025_08_25_00
