Who,scraped_datetime,Headline,Url,Site,Siteurl,Published
Al Jazeera,2025_12_17_05,Where in the world are wealth and income most unequal?,https://www.aljazeera.com/news/2025/12/10/where-in-the-world-are-wealth-and-income-most-unequal,Al Jazeera,https://www.aljazeera.com,2025_12_10_00
Al Jazeera,2025_12_17_05,Israel attacked Syria more than 600 times over the past year,https://www.aljazeera.com/news/2025/12/9/israel-attacked-syria-more-than-600-times-over-the-past-year,Al Jazeera,https://www.aljazeera.com,2025_12_09_00
Al Jazeera,2025_12_17_05,Satellite images show the scale of destruction from Asia floods,https://www.aljazeera.com/news/longform/2025/12/9/satellite-images-show-the-scale-of-destruction-from-asia-floods,Al Jazeera,https://www.aljazeera.com,2025_12_09_00
Al Jazeera,2025_12_17_05,How many Syrians have returned home one year since the fall of al-Assad?,https://www.aljazeera.com/news/2025/12/8/how-many-syrians-have-returned-home-one-year-since-the-fall-of-al-assad,Al Jazeera,https://www.aljazeera.com,2025_12_08_00
Al Jazeera,2025_12_17_05,How many times has Israel violated the Gaza ceasefire? Here are the numbers,https://www.aljazeera.com/news/2025/11/11/how-many-times-has-israel-violated-the-gaza-ceasefire-here-are-the-numbers,Al Jazeera,https://www.aljazeera.com,2025_11_11_00
