Who,scraped_datetime,Headline,Url,Site,Siteurl,Published
Al Jazeera,2025_08_12_05,Indian village swallowed by mudslide: What happened – and why?,https://www.aljazeera.com/news/2025/8/6/indian-village-swallowed-by-mudslide-what-happened-and-why,Al Jazeera,https://www.aljazeera.com,2025_08_06_00
Al Jazeera,2025_08_12_05,How much aid has entered Gaza?,https://www.aljazeera.com/news/2025/8/5/how-much-aid-has-entered-gaza-5,Al Jazeera,https://www.aljazeera.com,2025_08_05_00
Al Jazeera,2025_08_12_05,What has been the impact of Trump’s tariffs so far?,https://www.aljazeera.com/economy/2025/7/31/what-has-been-the-impact-of-trumps-tariffs-so-far,Al Jazeera,https://www.aljazeera.com,2025_07_31_00
Al Jazeera,2025_08_12_05,"How do air conditioners work, and what is the effect on the environment?",https://www.aljazeera.com/news/2025/7/26/how-do-air-conditioners-work-and-what-is-the-effect-on-the-environment,Al Jazeera,https://www.aljazeera.com,2025_07_26_00
Al Jazeera,2025_08_12_05,"How a Sri Lankan woman seeking asylum in the UK ended up in Rwanda
This article will be opened in a new browser window",https://interactive.aljazeera.com/aje/2025/rwanda/?utm_source=aljazeera.com&utm_medium=website&utm_campaign=ucms,Al Jazeera,https://www.aljazeera.com,2025_07_25_00
