Who,scraped_datetime,Headline,Url,Site,Siteurl,Published
Al Jazeera,2025_10_27_05,How many times has the US struck Venezuelan vessels?,https://www.aljazeera.com/news/2025/10/17/how-many-times-has-the-us-struck-venezuelan-vessels,Al Jazeera,https://www.aljazeera.com,2025_10_17_00
Al Jazeera,2025_10_27_05,"On World Food Day, Israel continues to restrict aid into Gaza",https://www.aljazeera.com/news/2025/10/16/on-world-food-day-israel-continues-to-restrict-aid-into-gaza,Al Jazeera,https://www.aljazeera.com,2025_10_16_00
Al Jazeera,2025_10_27_05,Which countries owe the IMF the most money in 2025?,https://www.aljazeera.com/news/2025/10/16/which-countries-owe-the-imf-the-most-money-in-2025,Al Jazeera,https://www.aljazeera.com,2025_10_16_00
Al Jazeera,2025_10_27_05,Mapping the rise in Israeli settler attacks across the occupied West Bank,https://www.aljazeera.com/news/2025/10/14/mapping-the-rise-in-israeli-settler-attacks-across-the-occupied-west-bank,Al Jazeera,https://www.aljazeera.com,2025_10_14_00
Al Jazeera,2025_10_27_05,Complete list of Nobel Peace Prize winners (1901–2024),https://www.aljazeera.com/news/2025/10/10/complete-list-of-nobel-peace-prize-winners-1901,Al Jazeera,https://www.aljazeera.com,2025_10_10_00
