Who,scraped_datetime,Headline,Url,Site,Siteurl,Published
Al Jazeera,2026_02_01_05,How does US military build-up off Iran compare to the June 2025 strikes?,https://www.aljazeera.com/news/2026/1/29/how-does-us-military-build-up-off-iran-compare-to-the-june-2025-strikes,Al Jazeera,https://www.aljazeera.com,2026_01_29_00
Al Jazeera,2026_02_01_05,Map shows what would happen to Gaza under the US ‘master plan’,https://www.aljazeera.com/news/2026/1/27/map-shows-what-would-happen-to-gaza-under-the-us-master-plan,Al Jazeera,https://www.aljazeera.com,2026_01_27_00
Al Jazeera,2026_02_01_05,Born after the Arab Spring: 37 million Egyptians have no memory of 2011,https://www.aljazeera.com/news/2026/1/26/born-after-the-arab-spring-37-million-egyptians-have-no-memory-of-2011,Al Jazeera,https://www.aljazeera.com,2026_01_26_00
Al Jazeera,2026_02_01_05,Mapping the 10 countries with the most overseas territories,https://www.aljazeera.com/news/2026/1/22/mapping-the-10-countries-with-the-most-overseas-territories,Al Jazeera,https://www.aljazeera.com,2026_01_22_00
Al Jazeera,2026_02_01_05,How many times has Israel violated the Gaza ceasefire? Here are the numbers,https://www.aljazeera.com/news/2025/11/11/how-many-times-has-israel-violated-the-gaza-ceasefire-here-are-the-numbers,Al Jazeera,https://www.aljazeera.com,2025_11_11_00
