Who,scraped_datetime,Headline,Url,Site,Siteurl,Published
Al Jazeera,2026_01_20_09,"US declares phase two of Gaza ceasefire, but what did phase one deliver?",https://www.aljazeera.com/news/2026/1/16/us-declares-phase-two-of-gaza-ceasefire-but-what-did-phase-one-deliver,Al Jazeera,https://www.aljazeera.com,2026_01_16_00
Al Jazeera,2026_01_20_09,Mapping who controls what in Yemen in 2026,https://www.aljazeera.com/news/2026/1/14/mapping-who-controls-what-in-yemen-in-2026,Al Jazeera,https://www.aljazeera.com,2026_01_14_00
Al Jazeera,2026_01_20_09,Which countries made the biggest deals with Israel in 2025?,https://www.aljazeera.com/news/2026/1/13/which-countries-made-the-biggest-deals-with-israel-in-2025,Al Jazeera,https://www.aljazeera.com,2026_01_13_00
Al Jazeera,2026_01_20_09,Which countries host the largest Venezuelan populations?,https://www.aljazeera.com/news/2026/1/12/which-countries-host-the-largest-venezuelan-populations,Al Jazeera,https://www.aljazeera.com,2026_01_12_00
Al Jazeera,2026_01_20_09,How many times has Israel violated the Gaza ceasefire? Here are the numbers,https://www.aljazeera.com/news/2025/11/11/how-many-times-has-israel-violated-the-gaza-ceasefire-here-are-the-numbers,Al Jazeera,https://www.aljazeera.com,2025_11_11_00
