Who,scraped_datetime,Headline,Url,Site,Siteurl,Published
Al Jazeera,2026_03_13_05,How will soaring oil prices caused by Iran war impact food costs?,https://www.aljazeera.com/news/2026/3/10/how-will-soaring-oil-prices-caused-by-iran-war-impact-food-prices,Al Jazeera,https://www.aljazeera.com,2026_03_10_00
Al Jazeera,2026_03_13_05,Where do the 35 million foreigners living in the GCC come from?,https://www.aljazeera.com/news/2026/3/9/where-do-the-35-million-foreigners-living-in-the-gcc-come-from,Al Jazeera,https://www.aljazeera.com,2026_03_09_00
Al Jazeera,2026_03_13_05,Which US and Israeli military companies are profiting from the Iran war?,https://www.aljazeera.com/news/2026/3/9/which-us-and-israeli-military-companies-are-profiting-from-the-iran-war,Al Jazeera,https://www.aljazeera.com,2026_03_09_00
Al Jazeera,2026_03_13_05,Map shows how big Iran is compared with the 50 US states,https://www.aljazeera.com/news/2026/3/5/map-shows-how-big-iran-is-compared-with-the-50-us-states,Al Jazeera,https://www.aljazeera.com,2026_03_05_00
Al Jazeera,2026_03_13_05,How many times has Israel violated the Gaza ceasefire? Here are the numbers,https://www.aljazeera.com/news/2025/11/11/how-many-times-has-israel-violated-the-gaza-ceasefire-here-are-the-numbers,Al Jazeera,https://www.aljazeera.com,2025_11_11_00
