Who,scraped_datetime,Headline,Url,Site,Siteurl,Published
SMH Visual Stories,2024_07_23_05,Maximum velocity: How the world’s fastest men tackle the 100m in less than 10 seconds,https://www.smh.com.au/interactive/2024/anatomy-of-running-100m/index.html,SMH,https://www.smh.com.au/,2024_07_22_19
SMH Visual Stories,2024_07_23_05,Mollie versus Arnie: The anatomy of a colossal Olympic showdown,https://www.smh.com.au/interactive/2024/anatomy-of-swimming/index.html,SMH,https://www.smh.com.au/,2024_07_22_19
SMH Visual Stories,2024_07_23_05,How do they do that? Inside the most dangerous event at the Olympics,https://www.smh.com.au/interactive/2024/anatomy-of-pole-vault/index.html,SMH,https://www.smh.com.au/,2024_07_22_19
SMH Visual Stories,2024_07_23_05,Want to get high? How a flop changed this Olympic event forever,https://www.smh.com.au/interactive/2024/faster-stronger-higher-high-jump/index.html,SMH,https://www.smh.com.au/,2024_07_21_19
SMH Visual Stories,2024_07_23_05,Like hurling a bowling ball the length of a tennis court. Is this the strongest man at the Olympics?,https://www.smh.com.au/interactive/2024/faster-higher-stronger-shot-put/index.html,SMH,https://www.smh.com.au/,2024_07_21_19
SMH Visual Stories,2024_07_23_05,How the Paris 1924 champions would go against today’s Olympians,https://www.smh.com.au/interactive/2024/faster-higher-stronger-1500m-run/index.html,SMH,https://www.smh.com.au/,2024_07_21_19
SMH Visual Stories,2024_07_23_05,"Do you earn enough? Your income, your suburb and how it compares nationally",https://www.smh.com.au/interactive/2024/do-you-earn-enough-2024/index.html,SMH,https://www.smh.com.au/,2024_07_07_05
SMH Visual Stories,2024_07_23_05,‘A lovely little girl’: Nine-year-old Charlise Mutten’s fateful Christmas holiday,https://www.smh.com.au/national/nsw/a-lovely-little-girl-nine-year-old-charlise-mutten-s-fateful-christmas-holiday-20240531-p5ji4s.html,SMH,https://www.smh.com.au/,2024_06_21_19
SMH Visual Stories,2024_07_23_05,‘I’ve just killed me kids’: His story never changed. But the science has,https://www.smh.com.au/interactive/2024/farquharson/index.html,SMH,https://www.smh.com.au/,2024_06_02_01
SMH Visual Stories,2024_07_23_05,Decoding Donald Trump’s reaction to guilty verdict,https://www.smh.com.au/world/north-america/decoding-trump-s-reaction-to-guilty-verdict-20240531-p5ji8w.html,SMH,https://www.smh.com.au/,2024_05_31_11
